{
  "schema_version": "1.0",
  "approved_understanding_sha256": "ff224a6a4a36a6b67d77be24602b5d0489d482a3cec2128ad2e3f8f5323d0ced",
  "approved_direction_sha256": "ea3096da2603b09bd3af29cdefda553eebe723a8ee5c1e5ec132421cb70d0fa5",
  "reference_lock_sha256": "1ab7408df01119bb7e6194db84cf9008e62e79f0a8727f95e0cf64d2e163f449",
  "ux_definition_sha256": "cfa1c4ff0e7dec586d23ea98680a440071aaf2e1f59f657d00c63a8c2bf20502",
  "sections": {
    "Provenance and Confidence": {
      "rules": [
        "Treat the approved shared understanding, direction decision, direction set, reference lock, and UX definition as the authority chain for this system.",
        "Label source observations, project inferences, recommendations, limitations, and unknowns as different truth classes. Do not promote an inference or recommendation into a source fact.",
        "Bind claim-level evidence to a stable evidence ID, source URL, retrieval date, and limitation when those fields exist in the approved public projection.",
        "The reference lock has high confidence. Literal token values and implementation details remain project recommendations until render, accessibility, and runtime checks pass."
      ],
      "evidence_refs": [
        ".design/shared-understanding.md",
        ".design/directions/decision.md",
        ".design/directions/direction-set.json",
        ".design/system/reference-lock.json",
        ".design/system/ux-definition.json"
      ]
    },
    "Approved Shared Understanding": {
      "rules": [
        "Build a public Design Reference Library that lets a person find, understand, compare, and download each of 60 reviewed public design cases.",
        "Make each case useful to people and tools through equivalent readable and structured outputs. Human-readable information is not secondary to machine-readable data.",
        "Show context, intent, value, quality, evidence, provenance, limitations, and unknowns before the visitor downloads a file.",
        "Keep private or operational material out of the public catalog and public downloads, including source notes, review identities, internal paths, archive URLs, redirect history, and operational notes.",
        "Keep the Site dependency-free, local-only, and static during this benchmark unless a later approved plan changes that boundary."
      ],
      "evidence_refs": [
        ".design/shared-understanding.md"
      ]
    },
    "Design North Star": {
      "rules": [
        "Every download is an explained evidence package, not an unexplained file action.",
        "Lead with the decision a person must make: what the case is, why it matters, what the package contains, what supports it, and where its limits are.",
        "Use technical detail to make the package precise after the human explanation has established meaning."
      ],
      "evidence_refs": [
        ".design/directions/decision.md",
        ".design/system/reference-lock.json"
      ]
    },
    "Product and User Principles": {
      "rules": [
        "A first-time visitor must be able to orient before encountering dense controls or file metadata.",
        "A repeat visitor must be able to search, filter, compare, and reach a package without losing current state.",
        "A person must be able to explain a case's useful design relationships and limits before applying it.",
        "A tool must receive stable field meanings, explicit truth classes, and deterministic output without requiring private project context.",
        "A failure must retain useful context and name the exact recovery action."
      ],
      "evidence_refs": [
        ".design/shared-understanding.md",
        ".design/system/ux-definition.json"
      ]
    },
    "Reference Foundation": {
      "rules": [
        "IBM Carbon is the sole dominant visual foundation for grid alignment, productive and expressive density, semantic color roles, contextual layers, and relationship-based component choice.",
        "Vercel Geist contributes only typography detail: distinguish explanation, labels, provenance, tabular values, file metadata, and machine identifiers.",
        "GOV.UK contributes only form behavior: name the exact validation, availability, or download problem and provide a specific remedy.",
        "GitHub Primer contributes only mobile behavior: reflow the package without removing context, evidence, format choice, limitations, or actions.",
        "Transfer relationships and behavior, not source identity, source geometry, branded fonts, palettes, logos, or product shells."
      ],
      "evidence_refs": [
        "CARBON-E01",
        "CARBON-E02",
        "CARBON-E03",
        "CARBON-E05",
        "GEIST-E03",
        "GEIST-E05",
        "GOVUK-E04",
        "GOVUK-E05",
        "PRIMER-E02",
        "PRIMER-E05"
      ]
    },
    "Reference Lock": {
      "rules": [
        "Preserve the visible alignment between context, evidence, metadata, limitations, and file actions.",
        "Preserve the distinction between open reading space and compact technical detail.",
        "Preserve stable roles for action, focus, status, border, and contextual surfaces.",
        "Permit original system and serif font stacks, an original warm neutral palette, and dimensions suited to the existing static Site.",
        "Forbid copied Carbon geometry, IBM blue, Geist monochrome identity, GOV.UK styling, GitHub shell patterns, source logos, borrowed fonts, and third-party assets."
      ],
      "evidence_refs": [
        ".design/system/reference-lock.json"
      ]
    },
    "Information Architecture": {
      "rules": [
        "Use one public library with five task regions: catalog, case, download package, comparison, and method.",
        "Keep the download package inside the case decision path so context and limitations precede file actions.",
        "Keep method guidance reachable from the catalog and package without requiring a download.",
        "Keep search, lane filters, six approved facets, sorting, case selection, and comparison state visible at the point where they affect results.",
        "Do not expose a navigation path to private, review, blocked, or invalid case data."
      ],
      "evidence_refs": [
        ".design/system/ux-definition.json"
      ]
    },
    "Screens and User Flows": {
      "rules": [
        "Implement the catalog, case-detail, download-package, comparison, and method screens defined in the UX source.",
        "Preserve four complete flows: find and understand a case, compare cases, inspect and download a public case, and understand the method.",
        "Every screen must implement default, loading, empty, error, and permission-denied states without clearing valid context.",
        "The download flow succeeds only when the named readable or structured file is produced from the approved public projection after its package contract is visible.",
        "Invalid or non-public identifiers must return to public context without revealing hidden fields."
      ],
      "evidence_refs": [
        ".design/system/ux-definition.json"
      ]
    },
    "Layout and Grid": {
      "rules": [
        "Use a visible 12-column wide grid, a 6-column medium grid, and a 4-column compact grid as alignment logic rather than as decoration.",
        "Align package identity, context, evidence, limitations, format detail, and action bands to shared column edges.",
        "Limit sustained prose to about 68 characters per line and allow manifests, tables, and metadata to use the wider task region.",
        "Use full-width rules and contextual bands to mark changes in information job. Avoid a uniform card grid.",
        "Place the primary page container at a maximum readable width while allowing the bounded comparison region to use available horizontal space."
      ],
      "evidence_refs": [
        ".design/system/reference-lock.json",
        "CARBON-E01",
        "CARBON-E03"
      ]
    },
    "Responsive Strategy": {
      "rules": [
        "Use the approved base, compact, medium, and wide breakpoints as re-composition thresholds, not device labels.",
        "Keep identity, context, value, evidence quality, limitations, and the primary action in that priority order at every width.",
        "Show readable and structured formats side by side only when both remain legible. Otherwise present complete sequential sections.",
        "Keep only the comparison table inside a labeled bounded horizontal scroll region. The page itself must not overflow horizontally.",
        "Collapse advanced filters on narrow layouts without removing any filter, active-state summary, or reset action."
      ],
      "evidence_refs": [
        ".design/system/ux-definition.json",
        "PRIMER-E02",
        "PRIMER-E05"
      ]
    },
    "Typography": {
      "rules": [
        "Use an original serif system stack for case theses and restrained section emphasis, an original sans system stack for reading and controls, and a system monospace stack for identifiers and exact file data.",
        "Human explanation must lead each screen. Labels, provenance, tabular values, file details, evidence IDs, and machine identifiers must form visibly subordinate technical registers.",
        "Use sentence case for headings, labels, buttons, errors, and status text.",
        "Use tabular numerals for counts, dates, sizes, and aligned values when the font supports them.",
        "Do not reduce metadata below a readable size or use type weight alone to communicate state."
      ],
      "evidence_refs": [
        "GEIST-E03",
        "GEIST-E05",
        ".design/system/reference-lock.json"
      ]
    },
    "Color and Semantic Roles": {
      "rules": [
        "Use an original warm neutral canvas and layered surfaces. Do not use IBM blue or reproduce any reference palette.",